{
  "$schema": "https://json-schema.org/draft/2020-12/schema",
  "$id": "https://schemas.alos.dev/v1/evidence/evidence-bundle.schema.json",
  "title": "EvidenceBundle",
  "type": "object",
  "required": ["bundle_id", "tenant_id", "organization_id", "workspace_id", "correlation_id", "evidence_refs"],
  "properties": {
    "bundle_id": { "$ref": "https://schemas.alos.dev/v1/common/identifiers.schema.json#/$defs/canonical_id" },
    "tenant_id": { "$ref": "https://schemas.alos.dev/v1/common/identifiers.schema.json#/$defs/tenant_id" },
    "organization_id": { "$ref": "https://schemas.alos.dev/v1/common/identifiers.schema.json#/$defs/organization_id" },
    "workspace_id": { "$ref": "https://schemas.alos.dev/v1/common/identifiers.schema.json#/$defs/workspace_id" },
    "run_id": { "$ref": "https://schemas.alos.dev/v1/common/identifiers.schema.json#/$defs/run_id" },
    "correlation_id": { "$ref": "https://schemas.alos.dev/v1/common/identifiers.schema.json#/$defs/correlation_id" },
    "scope_refs": { "type": "array", "minItems": 1, "items": { "type": "string", "minLength": 1 }, "uniqueItems": true },
    "evidence_refs": { "type": "array", "minItems": 1, "items": { "$ref": "https://schemas.alos.dev/v1/evidence/evidence-ref.schema.json" } }
  },
  "additionalProperties": false
}
