{
  "$schema": "https://schemas.alos.dev/v1/evidence/evidence-bundle.schema.json",
  "bundle_id": "bundle_mvp1_research_001",
  "tenant_id": "tenant_mvp1_001",
  "organization_id": "org_mvp1_001",
  "workspace_id": "workspace_mvp1_001",
  "run_id": "run_mvp1_research_001",
  "correlation_id": "corr_mvp1_evidence_001",
  "evidence_refs": [
    {
      "evidence_id": "evidence_mvp1_research_001",
      "source_id": "source_mvp1_research_001",
      "uri": "https://evidence.alos.dev/mvp1/research/001",
      "captured_at": "2026-09-16T02:00:00Z",
      "content_hash": "sha256:bbbbbbbbbbbbbbbbbbbbbbbbbbbbbbbbbbbbbbbbbbbbbbbbbbbbbbbbbbbbbbbb"
    }
  ]
}
